肿瘤	腫瘤	zhǒng liú	tumor	z	我有脑肿瘤。	I have a brain tumor.	wǒyǒunǎozhǒnglíu。	肿瘤 (1.000)<br>恶性肿瘤 (0.811)<br>癌细胞 (0.809)
遭遇	遭遇	zāo yù	to meet with; to encounter; (bitter) experience	z	马德里竞技遭遇失败后，很明显大家都很生气。	It was evident that everyone was upset when Atletico Madrid suffered defeat.	mǎdélǐjìngjìzāoyùshībàihòu，hěnmíngxiǎndàjiādūhěnshēngqì。	遭遇 (1.000)<br>遭受 (0.826)
掌控	掌控	zhǎng kòng	to control; in control of	z				掌控 (1.000)
毒蛇	毒蛇	dú shé	viper	d				毒蛇 (1.000)
防弹衣	防彈衣	fáng dàn yī	bulletproof vest	f	湯姆穿著一件防彈衣，所以子彈沒把他殺死。	Tom was wearing a bulletproof vest, so the bullet didn't kill him.	tāngmǔchuānzhùyījiànfángdànyī，suǒyǐzǐdànméibǎtāshāsǐ。	防弹衣 (1.000)<br>防弹背心 (0.820)
公社	公社	gōng shè	commune					
